{"$schema":"https://json-schema.org/draft/2020-12/schema","type":"object","required":["schema_version","input_digests","coverage","layer_summaries","review_queues","adaptation_candidates","handoff"],"properties":{"schema_version":{"const":1},"input_digests":{"type":"object"},"coverage":{"type":"object"},"layer_summaries":{"type":"array"},"review_queues":{"type":"object"},"adaptation_candidates":{"type":"array"},"handoff":{"type":"string"}},"additionalProperties":false}
