{
  "adaptation_candidates": [
    {
      "area": "build-ci",
      "paths": [
        ".github/ISSUE_TEMPLATE/bug.yml",
        ".github/ISSUE_TEMPLATE/config.yml",
        ".github/ISSUE_TEMPLATE/good_first_issue.yml",
        ".github/ISSUE_TEMPLATE/gui_issue.yml",
        ".github/PULL_REQUEST_TEMPLATE.md",
        ".github/actions/configure-docker/action.yml",
        ".github/actions/configure-docker/action.yml",
        ".github/actions/restore-caches/action.yml",
        ".github/actions/save-caches/action.yml",
        ".github/actions/setup-windows-gui-tools/action.yml",
        ".github/workflows/ci.yml",
        ".github/workflows/ci.yml",
        ".github/workflows/create-release.yml",
        ".github/workflows/deploy-docs.yml",
        ".github/workflows/nightly.yml",
        ".github/workflows/release.yml",
        "CMakeLists.txt",
        "CMakeLists.txt",
        "CMakeLists.txt",
        "ci/README.md",
        "ci/change-classifier-policy.json",
        "ci/change-classifier.py",
        "ci/lint/06_script.sh",
        "ci/nightly-change-gate.py",
        "ci/release/archive.py",
        "ci/release/prepare-release.sh",
        "ci/release/validate-release-tag.sh",
        "ci/test/00_setup_env.sh",
        "ci/test/00_setup_env_i686_multiprocess.sh",
        "ci/test/00_setup_env_i686_multiprocess.sh",
        "ci/test/00_setup_env_linux_aarch64_release.sh",
        "ci/test/00_setup_env_linux_x86_64_release.sh",
        "ci/test/00_setup_env_mac_cross.sh",
        "ci/test/00_setup_env_mac_cross.sh",
        "ci/test/00_setup_env_mac_native.sh",
        "ci/test/00_setup_env_mac_native.sh",
        "ci/test/00_setup_env_native_asan.sh",
        "ci/test/00_setup_env_native_asan.sh",
        "ci/test/00_setup_env_native_centos.sh",
        "ci/test/00_setup_env_native_centos.sh",
        "ci/test/00_setup_env_native_extended_functional.sh",
        "ci/test/00_setup_env_native_gui.sh",
        "ci/test/00_setup_env_native_nowallet_libbitcoinkernel.sh",
        "ci/test/00_setup_env_native_previous_releases.sh",
        "ci/test/00_setup_env_native_previous_releases.sh",
        "ci/test/00_setup_env_native_tidy.sh",
        "ci/test/00_setup_env_native_tidy.sh",
        "ci/test/00_setup_env_native_valgrind.sh",
        "ci/test/03_test_script.sh",
        "ci/test/fixtures/change-classifier.json",
        "ci/test/fixtures/nightly-change-gate.json",
        "ci/test/test_change_classifier.py",
        "ci/test/test_gui_qrencode.py",
        "ci/test/test_nightly_change_gate.py",
        "ci/test/test_prepare_release.py",
        "ci/test/test_release_version.py",
        "ci/test/test_validate_release_tag.py",
        "ci/test/test_windows_gui_workflows.py",
        "cmake/bitcoin-build-config.h.in",
        "cmake/bitcoin-build-config.h.in",
        "cmake/introspection.cmake",
        "cmake/iopriority.cmake",
        "cmake/iopriority.cmake",
        "cmake/leveldb.cmake",
        "cmake/mempressure.cmake",
        "cmake/mempressure.cmake",
        "cmake/module/AddBoostIfNeeded.cmake",
        "cmake/module/ClientVersion.cmake",
        "cmake/module/FindLevelDB.cmake",
        "cmake/module/FindLevelDB.cmake",
        "cmake/module/FindMiniUPnPc.cmake",
        "cmake/module/InstallBinaryComponent.cmake",
        "cmake/module/Maintenance.cmake",
        "cmake/script/GenerateBuildInfo.cmake",
        "doc/website/content/doc/CMakeLists.txt",
        "src/CMakeLists.txt",
        "src/bench/CMakeLists.txt",
        "src/consensus/CMakeLists.txt",
        "src/crypto/CMakeLists.txt",
        "src/kernel/CMakeLists.txt",
        "src/qt/CMakeLists.txt",
        "src/qt/CMakeLists.txt",
        "src/qt/test/CMakeLists.txt",
        "src/secp256k1/cmake/CheckX86_64Assembly.cmake",
        "src/test/CMakeLists.txt",
        "src/test/fuzz/CMakeLists.txt",
        "src/test/util/CMakeLists.txt",
        "src/util/CMakeLists.txt",
        "src/wallet/test/CMakeLists.txt",
        "src/zmq/CMakeLists.txt"
      ]
    },
    {
      "area": "common",
      "paths": [
        "CMakePresets.json",
        "CONTRIBUTING.md",
        "CONTRIBUTING.md",
        "README.md",
        "README.md",
        "README.md",
        "SECURITY.md",
        "SECURITY.md",
        "contrib/completions/bash/bitcoin-cli.bash",
        "contrib/debian/copyright",
        "contrib/debian/copyright",
        "contrib/devtools/check-deps.sh",
        "contrib/devtools/circular-dependencies.py",
        "contrib/devtools/gen-manpages.py",
        "contrib/devtools/security-check.py",
        "contrib/devtools/symbol-check.py",
        "contrib/docker/Dockerfile",
        "contrib/docker/README.md",
        "contrib/docker/README.md",
        "contrib/guix/guix-build",
        "contrib/guix/guix-clean",
        "contrib/guix/guix-codesign",
        "contrib/guix/libexec/build.sh",
        "contrib/guix/libexec/make_release_tarball.sh",
        "contrib/guix/libexec/prelude.bash",
        "contrib/guix/manifest.scm",
        "contrib/init/bitcoind.conf",
        "contrib/init/bitcoind.conf",
        "contrib/init/bitcoind.init",
        "contrib/init/bitcoind.init",
        "contrib/init/bitcoind.openrc",
        "contrib/init/bitcoind.openrc",
        "contrib/init/bitcoind.openrcconf",
        "contrib/release/bitcoin-roots-release-key.asc",
        "depends/Makefile",
        "depends/README.md",
        "depends/funcs.mk",
        "depends/packages/miniupnpc.mk",
        "depends/packages/packages.mk",
        "depends/packages/qrencode.mk",
        "depends/packages/qt.mk",
        "depends/patches/miniupnpc/dont_leak_info.patch",
        "depends/patches/qt/qdir_temppath.patch",
        "depends/toolchain.cmake.in",
        "libbitcoinconsensus.pc.in",
        "share/examples/bitcoin.conf",
        "share/rpcauth/rpcauth.py",
        "share/setup.nsi.in",
        "share/setup.nsi.in",
        "src/.clang-tidy",
        "src/addrdb.cpp",
        "src/addrman.cpp",
        "src/arith_uint256.h",
        "src/banman.cpp",
        "src/banman.h",
        "src/bech32.cpp",
        "src/bech32.h",
        "src/bench/checkqueue.cpp",
        "src/bench/mempool_ephemeral_spends.cpp",
        "src/bench/mempool_eviction.cpp",
        "src/bench/mempool_stress.cpp",
        "src/bench/prevector.cpp",
        "src/bench/rpc_blockchain.cpp",
        "src/bench/rpc_mempool.cpp",
        "src/bench/streams_findbyte.cpp",
        "src/bench/verify_script.cpp",
        "src/bench/wallet_migration.cpp",
        "src/bench/xor.cpp",
        "src/bitcoin-chainstate.cpp",
        "src/bitcoin-cli.cpp",
        "src/bitcoin-wallet.cpp",
        "src/bitcoind.cpp",
        "src/blockencodings.cpp",
        "src/blockfilter.cpp",
        "src/blockfilter.h",
        "src/chain.h",
        "src/chainparams.cpp",
        "src/chainparamsbase.cpp",
        "src/chainparamsbase.h",
        "src/checkqueue.h",
        "src/clientversion.cpp",
        "src/clientversion.cpp",
        "src/clientversion.cpp",
        "src/clientversion.h",
        "src/clientversion.h",
        "src/codex32.cpp",
        "src/codex32.h",
        "src/common/args.cpp",
        "src/common/args.h",
        "src/common/config.cpp",
        "src/common/netif.cpp",
        "src/common/pcp.cpp",
        "src/common/pcp.h",
        "src/common/run_command.cpp",
        "src/common/settings.cpp",
        "src/common/settings.h",
        "src/common/signmessage.cpp",
        "src/common/signmessage.h",
        "src/common/system.cpp",
        "src/common/system.h",
        "src/common/system_ram.cpp",
        "src/common/system_ram.h",
        "src/compat/stdin.cpp",
        "src/core_io.h",
        "src/core_read.cpp",
        "src/core_write.cpp",
        "src/crypto/sha256.cpp",
        "src/crypto/sha256_avx2.cpp",
        "src/crypto/sha256_power8.cpp",
        "src/crypto/sha256_sse41.cpp",
        "src/crypto/sha256_x86_shani.cpp",
        "src/crypto/siphash.cpp",
        "src/dbwrapper.cpp",
        "src/dbwrapper.h",
        "src/dummywallet.cpp",
        "src/external_signer.cpp",
        "src/flatfile.cpp",
        "src/headerssync.cpp",
        "src/httprpc.cpp",
        "src/httprpc.h",
        "src/httpserver.cpp",
        "src/i2p.cpp",
        "src/index/base.cpp",
        "src/index/base.h",
        "src/index/blockfilterindex.cpp",
        "src/index/blockfilterindex.h",
        "src/index/coinstatsindex.h",
        "src/index/txindex.h",
        "src/init.cpp",
        "src/init.cpp",
        "src/init.cpp",
        "src/init/common.cpp",
        "src/interfaces/chain.h",
        "src/interfaces/mining.h",
        "src/interfaces/node.h",
        "src/interfaces/wallet.h",
        "src/ipc/process.cpp",
        "src/kernel/blockmanager_opts.h",
        "src/kernel/chainparams.cpp",
        "src/kernel/chainparams.h",
        "src/kernel/checks.cpp",
        "src/kernel/checks.h",
        "src/kernel/coinstats.cpp",
        "src/kernel/mempool_entry.h",
        "src/kernel/mempool_options.h",
        "src/kernel/notifications_interface.h",
        "src/kernel/warning.h",
        "src/kernel/warning.h",
        "src/leveldb/db/db_impl.cc",
        "src/logging.cpp",
        "src/mapport.cpp",
        "src/mapport.h",
        "src/merkleblock.cpp",
        "src/merkleblock.h",
        "src/noui.cpp",
        "src/outputtype.cpp",
        "src/prevector.h",
        "src/protocol.cpp",
        "src/protocol.h",
        "src/psbt.cpp",
        "src/random.h",
        "src/rest.cpp",
        "src/rpc/blockchain.cpp",
        "src/rpc/blockchain.h",
        "src/rpc/client.cpp",
        "src/rpc/fees.cpp",
        "src/rpc/mempool.cpp",
        "src/rpc/mempool.h",
        "src/rpc/mining.cpp",
        "src/rpc/net.cpp",
        "src/rpc/node.cpp",
        "src/rpc/output_script.cpp",
        "src/rpc/rawtransaction.cpp",
        "src/rpc/rawtransaction.h",
        "src/rpc/rawtransaction_util.cpp",
        "src/rpc/rawtransaction_util.h",